{
  "contract": "ecos-capability-exchange.v1",
  "request_id": "request.demo.0001",
  "status": "complete",
  "output": {
    "location": "inline",
    "media_type": "application/json",
    "schema": "numeric.summary.v1",
    "digest": "sha256:2222222222222222222222222222222222222222222222222222222222222222",
    "value": { "count": 4, "sum": 10, "min": 1, "max": 4, "mean": 2.5 }
  },
  "receipt": {
    "capability": "numeric.summary.v1",
    "executor": "reference-fixture",
    "deployment_digest": "sha256:3333333333333333333333333333333333333333333333333333333333333333",
    "locality": "endpoint",
    "device": "cpu",
    "network_used": false,
    "started_at": "2026-10-06T10:00:00Z",
    "finished_at": "2026-10-06T10:00:00Z",
    "duration_ms": 1,
    "cache": "not-applicable"
  }
}
